isbn13,isbn10,title,author,publisher,description
9780385548984,,THE WIDOW,John Grisham,Doubleday,"When Simon Latch, a lawyer in rural Virginia, is accused of murder, he goes in search of the real killer."
9780385546898,,THE SECRET OF SECRETS,Dan Brown,Doubleday,"As he searches for the missing noetic scientist he has been seeing, Robert Langdon discovers something regarding a secret project."
9780593972700,,ALCHEMISED,SenLinYu,Del Rey,"After the war, an imprisoned alchemist is sent to a necromancer to recover her lost memories."
9781538774700,,GONE BEFORE GOODBYE,Reese Witherspoon and Harlan Coben,Grand Central,"When a mysterious man disappears, the former combat surgeon giving him medical assistance goes on the lam."
9781668014905,,THE CHRISTMAS STRANGER,Richard Paul Evans,Gallery,"Three years after a tragedy, a computer repairman encounters several people who make him reconsider the value of his life."
9780062406682,,TWICE,Mitch Albom,Harper,"Alfie Logan, who was gifted with the ability to live any moment a second time but must accept the outcomes, makes a risky love decision."
9798217154043,,REMAIN,Nicholas Sparks with M. Night Shyamalan,Random House,"A New York architect moves to Cape Cod, where he enters a relationship that brings up a lot of questions."
9780316563826,,THE PROVING GROUND,Michael Connelly,"Little, Brown",The eighth book in the Lincoln Lawyer series. Mickey Haller enlists a journalist to help his lawsuit against an A.I. company.
9781464260919,,THE INTRUDER,Freida McFadden,Poisoned Pen,"During a rough storm, Casey puts herself in danger when she lets a girl, who is covered in blood, into her cabin."
9781250245373,,EMPIRE OF THE DAWN,Jay Kristoff,St. Martin's,The third book in the Empire of the Vampire series. A final battle will alter the state of the Empire.
9781250328175,,THE BLACK WOLF,Louise Penny,Minotaur,"The 20th book in the Chief Inspector Gamache series. After thwarting a terrorist attack, an injured Gamache leads a covert investigation."
9781335146984,,BONDS OF HERCULES,Jasmine Mas,Canary Street,The second book in the Villains of Lore series. Seduction and danger put Hercules in a tough spot.
9780593798430,,THE CORRESPONDENT,Virginia Evans,Crown,Letters from someone she used to know push Sybil Van Antwerp toward revisiting her past and finding a way to forgive.
9781501189449,,QUEEN ESTHER,John Irving,Simon & Schuster,"In a novel set in the world of “The Cider House Rules,” a Jewish woman who grew up orphaned is affected by antisemitism."
9780593975206,,THE BRIDGE KINGDOM,Danielle L. Jensen,Del Rey,Lara’s sense of self and loyalty to her land become tested as her feelings toward her husband shift.
9780063021471,,KATABASIS,R.F. Kuang,Harper Voyager,A pair of rival graduate students descend into the underworld to save their late professor and secure his recommendation.
9780063451919,,THE COLOR OF DEATH,Trey Gowdy with Christopher Greyson,Fox News,"After a tragedy strikes his family, an assistant district attorney investigates the murder of a young woman."
9781538774205,,QUICKSILVER,Callie Hart,Forever,"Saeris is transported to a dangerous land of ice and snow, where she must contend with a Fae warrior who has suspect agendas."
9780593158715,,ATMOSPHERE,Taylor Jenkins Reid,Ballantine,"In the summer of 1980, Joan Goodwin begins training with a group of candidates for NASA’s space shuttle program."
9781982112820,,MY FRIENDS,Fredrik Backman,Atria,A young woman looks into the story behind a painting that was made 25 years ago and a small group of teens depicted in it; translated by Neil Smith.
9781668078181,,BROKEN COUNTRY,Clare Leslie Hall,Simon & Schuster,Beth must confront her past when the man she once loved as a teenager returns to the village with his son.
9781649377159,,ONYX STORM,Rebecca Yarros,Red Tower,"The third book in the Empyrean series. As enemies gain traction, Violet Sorrengail goes beyond the Aretian wards in search of allies."
9780008759827,,THE PUMPKIN SPICE CAFÉ,Laurie Gilmore,HarperCollins,Jeanie takes over her aunt’s café in Dream Harbor and encounters a local farmer.
9780778306269,,ON WINGS OF BLOOD,Briar Boleyn,MIRA,A dragon rider named Medra Pendragon is captured by vampires and placed inside the dangerous Bloodwing Academy.
9781668089330,,NEVER FLINCH,Stephen King,Scribner,Holly Gibney does double duty by helping head off acts of retribution and protecting a women’s rights activist.
9780593441299,,GREAT BIG BEAUTIFUL LIFE,Emily Henry,Berkley,A writer looking for her big break competes against a Pulitzer winner to tell the story of an octogenarian with a storied past.
9781250887979,,FORGET ME NOT,Stacy Willingham,Minotaur,"An investigative journalist returns to South Carolina, where she comes across a diary that appears to have details related to unsolved crimes."
9781250899576,,THE WEDDING PEOPLE,Alison Espach,Holt,A woman who is down on her luck forms an unexpected bond with the bride at a wedding in Rhode Island.
9780593820247,,DUNGEON CRAWLER CARL,Matt Dinniman,Ace,"A Coast Guard vet named Carl and his ex-girlfriend’s cat, Princess Donut, are trapped in a fantasy dungeon."
9780385550369,,JAMES,Percival Everett,Doubleday,"A reimagining of “Adventures of Huckleberry Finn” shines a different light on Mark Twain's classic, revealing new facets of the character of Jim."
9781538748367,,I WILL FIND YOU,Harlan Coben,Grand Central,A man imprisoned for murdering his 3-year-old son becomes convinced his son is still alive and plans an escape.
9780593243732,,HELLO BEAUTIFUL,Ann Napolitano,Dial,"In a homage to Louisa May Alcott’s “Little Women,” a young man’s dark past resurfaces as he gets to know the family of his college sweetheart."
9780385547345,,LESSONS IN CHEMISTRY,Bonnie Garmus,Doubleday,A scientist and single mother living in California in the 1960s becomes a star on a TV cooking show.
9780593321201,,"TOMORROW, AND TOMORROW, AND TOMORROW",Gabrielle Zevin,Knopf,Two friends find their partnership challenged in the world of video game design.
9780593331309,,STORM WATCH,C.J. Box,Putnam,The 23rd book in the Joe Pickett series. Joe and Nate might be on opposite sides for the first time.
9780593490693,,PINEAPPLE STREET,Jenny Jackson,Pamela Dorman,Three women navigate their roles in a well-to-do family living in Brooklyn Heights.
9781984821805,,WORTHY OPPONENTS,Danielle Steel,Delacorte,A divorced mother of twins and chief executive of a luxury department store goes against a wealthy investor looking to take it over.
9780063251922,,DEMON COPPERHEAD,Barbara Kingsolver,Harper,Winner of a 2023 Pulitzer Prize for fiction. A reimagining of Charles Dickens’s “David Copperfield” set in the mountains of southern Appalachia.
9781984879295,,SOMEONE ELSE'S SHOES,Jojo Moyes,Pamela Dorman,Drastic changes and a pair of six-inch high Christian Louboutin red crocodile shoes shake up the lives of two women.
9780593490143,,I HAVE SOME QUESTIONS FOR YOU,Rebecca Makkai,Viking,A film professor and podcaster is invited back to teach a course at the boarding school where her roommate was murdered.
9780063204157,,REMARKABLY BRIGHT CREATURES,Shelby Van Pelt,Ecco,A widow working the night shift at the Sowell Bay Aquarium is aided in solving a mystery by a giant Pacific octopus living there.
9781635577921,,A DAY OF FALLEN NIGHT,Samantha Shannon,Bloomsbury,"A prequel to “The Priory of the Orange Tree.” When the Dreadmount erupts, several women must protect humankind."
9780802162366,,SO SHALL YOU REAP,Donna Leon,Atlantic Monthly,The 32nd book in the Commissario Brunetti series. Brunetti looks into the murder of an undocumented Sri Lankan immigrant.
9781984818386,,MAD HONEY,Jodi Picoult and Jennifer Finney Boylan,Ballantine,"After returning to her hometown, Olivia McAfee’s son gets accused of killing his crush."
9780778387114,,THE LONDON SÉANCE SOCIETY,Sarah Penner,Park Row,"In 1873, a woman seeking answers about her sister’s death accompanies a spiritualist to look into a murder."
9780062834843,,THE ORDER,Daniel Silva,Harper,The 20th book in the Gabriel Allon series. The art restorer and spy cuts his family’s vacation short to investigate whether Pope Paul VII was murdered.
9780451464415,,PEACE TALKS,Jim Butcher,Ace,The 16th book in the Dresden Files series. Chicago's only professional wizard tries to keep the peace during a summit of the Supernatural nations of the world.
9780735219090,,WHERE THE CRAWDADS SING,Delia Owens,Putnam,"In a quiet town on the North Carolina coast in 1969, a young woman who survived alone in the marsh becomes a murder suspect."
9780525536291,,THE VANISHING HALF,Brit Bennett,Riverhead,The lives of twin sisters who run away from a Southern Black community at age 16 diverge as one returns and the other takes on a different racial identity but their fates intertwine.
9780316420044,,28 SUMMERS,Elin Hilderbrand,"Little, Brown",A relationship that started in 1993 between Mallory Blessing and Jake McCloud comes to light while she is on her deathbed and his wife runs for president.
9780385546270,,SEX AND VANITY,Kevin Kwan,Doubleday,A nod to “A Room With a View” in which Lucie Tang Churchill is torn between her WASPy billionaire fiancé and a privileged hunk born in Hong Kong.
9780062868930,,THE GUEST LIST,Lucy Foley,Morrow,A wedding between a TV star and a magazine publisher on an island off the coast of Ireland turns deadly.
9780385545938,,CAMINO WINDS,John Grisham,Doubleday,The line between fact and fiction becomes blurred when an author of thrillers is found dead after a hurricane hits Camino Island.
9780812997439,,UTOPIA AVENUE,David Mitchell,Random House,The glories and misadventures of a 1960s British band told from several perspectives with cameos by real-life musicians.
9780399181368,,A WALK ALONG THE BEACH,Debbie Macomber,Ballantine,"After dealing with loss and setbacks, two sisters take risks on dreams and love."
9781982137977,,IF IT BLEEDS,Stephen King,Scribner,"Four novellas: “Mr. Harrigan’s Phone,” “The Life of Chuck,” “Rat” and “If It Bleeds.”"
9781250209764,,AMERICAN DIRT,Jeanine Cummins,Flatiron,A bookseller flees Mexico for the United States with her son while pursued by the head of a drug cartel.
9780316539555,,THE SUMMER HOUSE,James Patterson and Brendan DuBois,"Little, Brown","Jeremiah Cook, a veteran and former N.Y.P.D. cop, investigates a mass murder near a lake in Georgia."
9780525620785,,MEXICAN GOTHIC,Silvia Moreno-Garcia,Del Rey,"In 1950s Mexico, a debutante travels to a distant mansion where family secrets of a faded mining empire have been kept hidden."
9781501133510,,BIG SUMMER,Jennifer Weiner,Atria,Daphne Berg’s former best friend asks her to be the maid of honor at her wedding in Cape Cod.
9781538719671,,A GAMBLING MAN,David Baldacci,Grand Central,"Aloysius Archer, a World War II veteran, seeks to apprentice with Willie Dash, a private eye, in a corrupt California town."
9780593465271,,THE HILL WE CLIMB,Amanda Gorman,Viking,"The poem read on President Joe Biden's Inauguration Day, by the youngest poet to write and perform an inaugural poem."
9780593087022,,OCEAN PREY,John Sandford,Putnam,"The 31st book in the Prey series. When federal officers are killed, Lucas Davenport and Virgil Flowers team up to investigate matters."
9781250178602,,THE FOUR WINDS,Kristin Hannah,St. Martin's,"As dust storms roll during the Great Depression, Elsa must choose between saving the family and farm or heading West."
9780525559474,,THE MIDNIGHT LIBRARY,Matt Haig,Viking,Nora Seed finds a library beyond the edge of the universe that contains books with multiple possibilities of the lives one could have lived.
9780765387561,,THE INVISIBLE LIFE OF ADDIE LARUE,V.E. Schwab,Tor/Forge,A Faustian bargain comes with a curse that affects the adventure Addie LaRue has across centuries.
9780593318171,,KLARA AND THE SUN,Kazuo Ishiguro,Knopf,An “Artificial Friend” named Klara is purchased to serve as a companion to an ailing 14-year-old girl.
9781501195129,,LOVER UNVEILED,J.R. Ward,Gallery,The 19th book in the Black Dagger Brotherhood series. Sahvage and Mae fight against what she unleashed.
9780316499408,,THE RED BOOK,James Patterson and David Ellis,"Little, Brown",The second book in the Black Book thriller series. Chicago detective Billy Harney investigates his own past.
9781250120953,,THE GOOD SISTER,Sally Hepworth,St. Martin's,"Past secrets come up when Fern decides to pay back her twin sister, Rose, by having a baby for her."
9781598536768,,THE MAN WHO LIVED UNDERGROUND,Richard Wright,Library of America,"A previously unpublished novel by the author of “Native Son,” with an afterword by his grandson Malcolm Wright. A Black man named Fred Daniels is tortured by the police until he confesses to a crime he did not commit."
9781538748213,,WIN,Harlan Coben,Grand Central,Windsor Horne Lockwood III might rectify cold cases connected to his family that have eluded the F.B.I. for decades.
9780778311010,,THE LOST APOTHECARY,Sarah Penner,Park Row,An aspiring historian in London finds a clue that might put to rest unsolved apothecary murders from 200 years ago.
9780062876003,,GOOD COMPANY,Cynthia D'Aprix Sweeney,Ecco,The foundation of a marriage between actors is shaken when they reunite with an old friend who is now a TV star.
9780316258678,,THE HOTEL NANTUCKET,Elin Hilderbrand,"Little, Brown",The new general manager of a hotel far from its Gilded Age heyday deals with the complicated pasts of her guests and staff.
9780385549325,,SPARRING PARTNERS,John Grisham,Doubleday,"Three novellas: “Homecoming,” “Strawberry Moon” and “Sparring Partners.”"
9781984821676,,SUSPECTS,Danielle Steel,Delacorte,A C.I.A. agent on a covert mission develops a relationship with a woman who is considered fashion royalty and has a tragic past.
9780593183199,,THE HOUSE ACROSS THE LAKE,Riley Sager,Dutton,An actress escaping bad press goes to a Vermont lake house and uncovers secrets within a neighboring couple’s marriage.
9780316499446,,ESCAPE,James Patterson and David Ellis,"Little, Brown",The third book in the Billy Harney thriller series. Detective Harney goes after a billionaire crime boss and a prison escape artist.
9780063204201,,THE MEASURE,Nikki Erlick,Morrow,People around the world receive a small wooden box telling them the exact number of years they will live.
9781501171345,,THE LAST THING HE TOLD ME,Laura Dave,Simon & Schuster,Hannah Hall discovers truths about her missing husband and bonds with his daughter from a previous relationship.
9780399562969,,HORSE,Geraldine Brooks,Viking,"The story of a racehorse, an enslaved groom and an itinerant painter reverberates in three different eras."
9780593358603,,STAR WARS: SHADOW OF THE SITH,Adam Christopher,Del Rey,"Nearly two decades after the Battle of Endor, Lando Calrissian informs Luke Skywalker of a new Sith menace."
9780425286647,,MEANT TO BE,Emily Giffin,Ballantine,"Joe, the disappointing scion of a family considered American royalty, and Cate, a budding model seeking to escape her surroundings, find each other."
9780759554344,,"RUN, ROSE, RUN",Dolly Parton and James Patterson,"Little, Brown",A singer-songwriter goes to Nashville seeking stardom but is followed by her dark past.
9780063003057,,THE PARIS APARTMENT,Lucy Foley,Morrow,Jess has suspicions about her half-brother’s neighbors when he goes missing.
9780593300268,,LAPVONA,Ottessa Moshfegh,Penguin Press,"When a motherless shepherd boy gets in violent proximity to a depraved lord’s family, occult forces upset the old order in a medieval fief."
9781538747278,,THE SCORPION'S TAIL,Douglas Preston and Lincoln Child,Grand Central,The second book in the Nora Kelly series. An F.B.I. agent and an archaeologist identify a mummified corpse and its gruesome cause of death.
9781984821379,,NEIGHBORS,Danielle Steel,Delacorte,A Hollywood recluse’s perspective changes when she invites her neighbors into her mansion after an earthquake.
9780593157718,,STAR WARS: LIGHT OF THE JEDI,Charles Soule,Del Rey,"In this installment of the High Republic series, a disaster in hyperspace may cause far greater damage."
9781501160837,,ANXIOUS PEOPLE,Fredrik Backman,Atria,A failed bank robber holds a group of strangers hostage at an apartment open house.
9781538728574,,THE RETURN,Nicholas Sparks,Grand Central,A doctor serving in the Navy in Afghanistan goes back to North Carolina where two women change his life.
9780385545969,,A TIME FOR MERCY,John Grisham,Doubleday,"The third book in the Jake Brigance series. A 16-year-old is accused of killing a deputy in Clanton, Miss., in 1990."
9781524761332,,READY PLAYER TWO,Ernest Cline,Ballantine,"In a sequel to “Ready Player One,” Wade Watts discovers a technological advancement and goes on a new quest."
9780525657606,,HAMNET,Maggie O'Farrell,Knopf,An imagined exploration of how the death of an 11-year-old boy to the Black Plague in 1596 might have affected a famous playwright and his wife.
9781635575422,,OUTLAWED,Anna North,Bloomsbury,"Ada, who apprentices midwifery under her mother, must decide whether to aid a band of outlaws who want to create a safe haven for outcast women."
9780316420259,,DEADLY CROSS,James Patterson,"Little, Brown",The 28th book in the Alex Cross series. An investigation of a double homicide sends Alex Cross to Alabama.
9780593449592,,COUNTING MIRACLES,Nicholas Sparks,Random House,A man in search of the father he never knew encounters a single mom and rumors circulate of the nearby appearance of a white deer.
9781250355669,,THE STARS ARE DYING,Chloe C. Peñaranda,Bramble,Astraea must decide whether to sneak in as a substitute in the trials that will determine the safety of her kingdom.
9780374602635,,INTERMEZZO,Sally Rooney,"Farrar, Straus and Giroux","After the passing of their father, seemingly different brothers engage in relationships and seek ways to cope."
9781250178633,,THE WOMEN,Kristin Hannah,St. Martin's,A nurse follows her brother to serve during the Vietnam War and returns to a divided America.
9781538770382,,IDENTITY UNKNOWN,Patricia Cornwell,Grand Central,The 28th book in the Kay Scarpetta Series. Scarpetta investigates the death of a former lover.
9781649374172,,IRON FLAME,Rebecca Yarros,Red Tower,The second book in the Empyrean series. Violet Sorrengail’s next round of training under the new vice commandant might require her to betray the man she loves.
9781250895783,,THE LAST ONE AT THE WEDDING,Jason Rekulak,Flatiron,Frank Szatowski finds himself in a tricky spot when his estranged daughter invites him to her wedding to the son of a tech billionaire.
9780316403894,,LIES HE TOLD ME,James Patterson and David Ellis,"Little, Brown",An act of heroism by an Illinois pub owner may lead to his undoing.
9781649374042,,FOURTH WING,Rebecca Yarros,Red Tower,"Violet Sorrengail is urged by the commanding general, who also is her mother, to become a candidate for the elite dragon riders."
9780593798607,,HERE ONE MOMENT,Liane Moriarty,Crown,Passengers on a short and seemingly unremarkable flight learn how and when they are going to die.
9780593418918,,THE GOD OF THE WOODS,Liz Moore,Riverhead,"When a 13-year-old girl disappears from an Adirondack summer camp in 1975, secrets kept by the Van Laar family emerge."
9780593798874,,ALL THE COLORS OF THE DARK,Chris Whitaker,Crown,Questions arise when a boy saves the daughter of a wealthy family amid a string of disappearances in a Missouri town in 1975.
9781668085721,,SPARK OF THE EVERFLAME,Penn Cole,Atria,"After her mother’s sudden disappearance, Diem Bellator goes on a quest to save her family and all mortalkind."
9780593446096,,TELL ME EVERYTHING,Elizabeth Strout,Random House,"As a murder casts a pall on a town in Maine, Lucy Barton, Olive Kitteridge and Bob Burgess share stories and seek meaning."
9781668037713,,YOU LIKE IT DARKER,Stephen King,Scribner,A dozen short stories that explore darkness in literal and metaphorical forms.
9781250232427,,THE SURVIVORS,Jane Harper,Flatiron,"Kieran Elliott takes his young family to his coastal hometown, where a body is found on the beach."
9780316420389,,THE RUSSIAN,James Patterson and James O. Born,"Little, Brown",The 13th book in the Michael Bennett series. An assassin killing a number of women might disrupt the detective’s wedding plans.
9780593296677,,THE SANATORIUM,Sarah Pearse,Pamela Dorman,"Elin Warner must find her estranged brother’s fiancée, who goes missing as a storm approaches a hotel that was once a sanatorium in the Swiss Alps."
9781101947807,,SEND FOR ME,Lauren Fox,Knopf,A woman in Wisconsin discovers a trove of her grandmother’s letters that detail her experiences in Germany leading up to World War II.
9780593295847,,GIRL A,Abigail Dean,Viking,"When their mother dies in prison, Lex Gracie and her siblings confront their shared past and shifting alliances."
9780525618553,,SERPENTINE,Jonathan Kellerman,Ballantine,The 36th book in the Alex Delaware series. Sturgis calls on Delaware to help solve a decades-old cold case.
9780063384217,,AN INSIDE JOB,Daniel Silva,Harper,"The 25th book in the Gabriel Allon series. The art world, the mob and the Vatican intersect when a Leonardo da Vinci painting goes missing."
9781250333988,,THE ENCHANTED GREENHOUSE,Sarah Beth Durst,Bramble,"In this novel set in the world of “The Spellshop,” Terlu Perna must figure out a sorcerer’s secrets to save an island containing magical greenhouses."
9781649379153,,THREE SHATTERED SOULS,Mai Corland,Red Tower,The third book in the Broken Blades series. Allegiances are upended as the Blades face new threats.
9781538771228,,ROSE IN CHAINS,Julie Soto,Forever,"After the dark forces win the war, Evermore's princess, Briony Rosewood, is auctioned off to a member of a family known for its viciousness."
9780778387480,,THE GIRL I WAS,Jeneva Rose,MIRA,"After a breakup and the loss of her job, Alexis wakes up in her college town in the year 2002 and comes across her 18-year-old self."
9781668025628,,THE WOMAN IN SUITE 11,Ruth Ware,Gallery/Scout,The second book in the Lo Blacklock series. Blacklock attends the opening of a luxury Swiss hotel and gets swept up in a dangerous pursuit across Europe.
9781538769997,,THE UNRAVELING OF JULIA,Lisa Scottoline,Grand Central,Julia Pritzker encounters strange and deadly things when she goes to claim the Tuscan villa and vineyard she inherited from a stranger.
9780593819456,,THE IRRESISTIBLE URGE TO FALL FOR YOUR ENEMY,Brigitte Knightley,Ace,Aurienne Fairhrim accepts an offer to heal a member of an enemy faction and an attraction develops.
9781538759196,,SAY YOU'LL REMEMBER ME,Abby Jimenez,Forever,"Despite having a great date, Samantha asks a veterinarian to forget about her because her family is in crisis."
9780063411661,,SUMMER IN THE CITY,Alex Aster,Morrow,A screenwriter seeking inspiration coincidentally moves next door to the billionaire with whom she hooked up a couple years ago.
9781250385086,,THE SIRENS,Emilia Hart,St. Martin's,"In 1800, two sisters head to Australia on a convict ship and notice changes in their bodies. In 2019, stories of men missing at sea and other odd occurrences emerge."
9781538756355,,NOBODY'S FOOL,Harlan Coben,Grand Central,The private investigator Sami Kierce tracks down clues to solve a mystery from his past.
9780593718407,,LETHAL PREY,John Sandford,Putnam,The 35th book in the Prey series. True-crime bloggers complicate Lucas Davenport and Virgil Flowers’s search for a killer.
9780316570008,,THE WRITER,James Patterson and J.D. Barker,"Little, Brown",An N.Y.P.D. detective is called to a crime scene in an apartment where the shelves are full of books by a true-crime writer.
9781668091968,,WILDFIRE,Hannah Grace,Atria,The second book in the Maple Hills series. Two summer camp counselors who previously had a one-night stand may run afoul of the camp’s rules.
9781524798659,,MALIBU RISING,Taylor Jenkins Reid,Ballantine,An epic party has serious outcomes for four famous siblings.
9780316540711,,THE PRESIDENT'S DAUGHTER,James Patterson and Bill Clinton,"Little, Brown","Matthew Keating, a past president and former Navy SEAL, goes on his own to find his abducted teenage daughter."
9780316420082,,GOLDEN GIRL,Elin Hilderbrand,"Little, Brown",A Nantucket novelist gets one final summer to watch what happens from the great beyond.
9780593183168,,SURVIVE THE NIGHT,Riley Sager,Dutton,"On a long ride back to Ohio in 1991, a college student suspects she might be sharing a car with the man known as the Campus Killer."
9781250304452,,THE MAIDENS,Alex Michaelides,Celadon,A therapist suspects a Greek tragedy professor at Cambridge University of committing murder.
9780593101537,,THE PERSONAL LIBRARIAN,Marie Benedict and Victoria Christopher Murray,Berkley,A Black woman who becomes one of the most powerful people in the art and book world is forced to hide her true identity.
9780593159415,,STAR WARS: THE RISING STORM,Cavan Scott,Del Rey,"In this installment of the High Republic series, Marchion Ro sows chaos at the Republic Fair."
9780385547680,,SOOLEY,John Grisham,Doubleday,Samuel Sooleymon receives a basketball scholarship to North Carolina Central and determines to bring his family over from a civil war-ravaged South Sudan.
9781982160135,,THE OTHER BLACK GIRL,Zakiya Dalila Harris,Atria,Tension unfurls when two young Black women meet against the starkly white backdrop of New York City book publishing.
9780593135204,,PROJECT HAIL MARY,Andy Weir,Ballantine,"Ryland Grace awakes from a long sleep alone and far from home, and the fate of humanity rests on his shoulders."
9781501133541,,THAT SUMMER,Jennifer Weiner,Atria,Daisy Shoemaker receives emails intended for a woman leading a more glamorous life and finds there was more to this accident.
9781982154837,,FORTUNE AND GLORY,Janet Evanovich,Atria,The 27th book in the Stephanie Plum series. Stephanie deals with a soldier of fortune from Little Havana.
9781984818461,,THE SENTINEL,Lee Child and Andrew Child,Delacorte,Jack Reacher intervenes on an ambush in Tennessee and uncovers a conspiracy.
