isbn13,isbn10,title,author,publisher,description
9781638932109,,TOURIST SEASON,Brynne Weaver,Slowburn,"When a true crime investigator comes to Cape Carnage in search of a serial killer, a local gardener and a handsome tourist pause their deadly ways."
9781538772775,,CIRCLE OF DAYS,Ken Follett,Grand Central,"A priestess envisions a great stone circle put together by divided tribes, but drought and violence may impede its creation."
9781250354921,,WHAT STALKS THE DEEP,T. Kingfisher,Tor Nightfire,The third book in the Sworn Soldier series. An old friend asks Alex Easton to search for his lost cousin.
9780316597739,,CROSSROADS OF RAVENS,Andrzej Sapkowski,Orbit,The ninth book in the Witcher series. Geralt of Rivia is mentored by a grizzled witcher; translated by David French.
9780802165176,,HEART THE LOVER,Lily King,Grove,"Decades after getting caught up in a love triangle, a woman examines choices she once made."
9781668057704,,WIDOW'S POINT,Richard Chizmar and W.H. Chizmar,Gallery,A lighthouse that is said to be cursed or haunted appears to cut visitors off from the outside world.
9780593318072,,FIRST PERSON SINGULAR,Haruki Murakami,Knopf,"A collection of eight short stories on love, childhood and memory."
9780735224995,,NORTHERN SPY,Flynn Berry,Viking,The sister of a BBC producer may have joined the Irish Republican Army.
9780593133781,,YOU LOVE ME,Caroline Kepnes,Random House,The third book in the You series. Joe becomes interested in a librarian who appears to be too busy for him.
9780525539766,,ETERNAL,Lisa Scottoline,Putnam,Three people involved in a love triangle find everything they hold dear is tested as Mussolini’s power grows and laws change in Rome.
9781250343154,,THE ASHES & THE STAR-CURSED KING,Carissa Broadbent,Bramble,The second book in the Crowns of Nyaxia series. Oraya faces a difficult choice between love and power.
9781649374073,,THE WREN IN THE HOLLY LIBRARY,K.A. Linde,Red Tower,A thief breaks the Monster Treaty that was created in the aftermath of the destruction of New York City years ago.
9781641296069,,THE COMFORT OF GHOSTS,Jacqueline Winspear,Soho Crime,The 18th book in the Maisie Dobbs series. Maisie looks into a decades-old mystery that involved her late husband.
9781668025598,,ONE PERFECT COUPLE,Ruth Ware,Gallery/Scout,"On a storm-swept island, there is a killer amid five couples who were cast on a reality TV series and are now unable to contact their crew."
9781649377104,,HEAVENBREAKER,Sara Wolf,Red Tower,A giant machine left over from the war has something unstoppable in it.
9781250289698,,MIND GAMES,Nora Roberts,St. Martin's,Thea shares the gift to see into the minds and souls of others with the man who killed her parents when she was 12 and now seeks vengeance.
9781250370112,,THE NIGHTINGALE,Kristin Hannah,St. Martin’s,"Two sisters in World War II France: one struggling to survive in the countryside, the other joining the Resistance in Paris."
9780593548189,,MIDNIGHT BLACK,Mark Greaney,Berkley,"The 14th book in the Gray Man series.  Gentry’s lover, a former spy for Russian foreign intelligence, is imprisoned in a Russian gulag."
9780316403689,,PARANOIA,James Patterson and James O. Born,"Little, Brown",The 17th book in the Michael Bennett series. Bennett goes after someone who is killing police officers.
9781984879325,,WE ALL LIVE HERE,Jojo Moyes,Pamela Dorman,"A woman, who is besieged by calamities in several facets of her life, finds her beliefs about family are tested."
9780385550666,,DREAM STATE,Eric Puchner,Doubleday,"Fifty years after a wedding in Montana, reverberations from that time continue to affect three friends and their children."
9780593803486,,THREE DAYS IN JUNE,Anne Tyler,Knopf,"As her daughter’s wedding draws near, Gail Baines faces issues with her job, her ex-husband and her past."
9781250370792,,BONDED IN DEATH,J.D. Robb,St. Martin's,The 60th book of the In Death series. Eve Dallas investigates the mysterious death of someone who was in a secret organization.
9781982164997,,VINCE FLYNN: CODE RED,Kyle Mills,Atria/Emily Bestler,The 22nd book in the Mitch Rapp series. Rapp and his team try to foil a plot by Russia without being discovered.
9781250750198,,FALL OF RUIN AND WRATH,Jennifer L. Armentrout,Bramble,"In a world where only nine cities were spared divine destruction, Calista must decide whether to follow her intuition to safety or court calamity by pursuing a love."
9780593418390,,THE VASTER WILDS,Lauren Groff,Riverhead,"A servant girl, who escapes with almost nothing from a colonial settlement, finds the beliefs she learned are tested."
9780525558965,,THE FRAUD,Zadie Smith,Penguin Press,"In 1873, a Scottish housekeeper to a once-famous novelist is captivated by a trial in which a lower-class butcher from Australia claims to be the rightful heir of a sizable estate and title."
9781250284099,,PAYBACK IN DEATH,J.D. Robb,St. Martin's,The 57th book of the In Death series. Eve Dallas looks into the death of an internal affairs captain.
9780063335776,,NINETEEN STEPS,Millie Bobby Brown with Kathleen McGurl,Morrow,"In 1942 London, 18-year-old Nellie Morris has a chance encounter with an American airman."
9780063315044,,MOTHER-DAUGHTER MURDER NIGHT,Nina Simon,Morrow,"When her granddaughter finds a dead body while kayaking, a convalescing Los Angeles businesswoman tries to uncover the truth."
9781982179212,,THE RIVER WE REMEMBER,William Kent Krueger,Atria,Suspicions and accusations complicate a sheriff’s investigation of a wealthy landowner’s murder in a small Minnesota town in 1958.
9781982151485,,THE BOOK OF MAGIC,Alice Hoffman,Simon & Schuster,The fourth book in the Practical Magic series. Three generations of Owens women try to save a young man’s life.
9781524743475,,A BEAUTIFULLY FOOLISH ENDEAVOR,Hank Green,Dutton,Mysterious books hint at what caused the untimely demise of April May and the sudden disappearance of robots known as the Carls.
9780316539425,,FAIR WARNING,Michael Connelly,"Little, Brown",The third book in the Jack McEvoy series. A reporter tracks a killer who uses genetic data to pick his victims.
9780525655978,,MEMOIRS AND MISINFORMATION,Jim Carrey and Dana Vachon,Knopf,A character named Jim Carrey navigates stardom and its excesses in a satire that borrows heavily from the life of the celebrity Jim Carrey.
9780316527583,,THE INN,James Patterson with Candice Fox,"Little, Brown",A former Boston police detective who is now an innkeeper must shield a seaside town from a crew of criminals.
9781250051059,,THE BITTERROOTS,C.J. Box,Minotaur,The fourth book in the Cassie Dewell series. The black sheep of an influential family is accused of assault.
9781538750568,,ONE GOOD DEED,David Baldacci,Grand Central,A World War II veteran on parole must find the real killer in a small town or face going back to jail.
9780385537070,,THE NICKEL BOYS,Colson Whitehead,Doubleday,Two boys respond to horrors at a Jim Crow-era reform school in ways that impact them decades later.
9781501188770,,THE TURN OF THE KEY,Ruth Ware,Scout,A nanny working in a technology-laden house in Scotland goes to jail when one of the children dies.
9780062834836,,THE NEW GIRL,Daniel Silva,Harper,"Gabriel Allon, the chief of Israeli intelligence, partners with the crown prince of Saudi Arabia, whose daughter is kidnapped."
9781455572199,,OUTFOX,Sandra Brown,Grand Central,F.B.I. Agent Drex Easton has a hunch that the conman Weston Graham is also a serial killer.
9781101947746,,CHANCES ARE ...,Richard Russo,Knopf,"Three men in their 60s who met in college reunite on Martha’s Vineyard, where mysterious events occurred in 1971."
9780593083130,,CONTRABAND,Stuart Woods,Putnam,The 50th book in the Stone Barrington series. Crimes come into focus in Key West and Manhattan.
9780812992861,,INLAND,Téa Obreht,Random House,The lives of a frontierswoman and a former outlaw intersect in the unforgiving climate of the Arizona Territory in 1893.
9780525535683,,A DANGEROUS MAN,Robert Crais,Putnam,Elvis Cole and Joe Pike get more than they bargained for when they investigate the abduction of a bank teller.
9781250047328,,THINGS YOU SAVE IN A FIRE,Katherine Center,St. Martin's,A Texas firefighter braves her estranged mother and the entrenched culture of a Boston firehouse.
9781982159467,,INFINITE COUNTRY,Patricia Engel,Avid Reader/Simon & Schuster,"A kaleidoscopic story of a family occupying two different countries, Colombia and the United States."
9781538702345,,WHAT'S MINE AND YOURS,Naima Coster,Grand Central,The integration of a North Carolina school ties together a pair of seemingly unconnected families for two decades.
9780802157065,,THE COMMITTED,Viet Thanh Nguyen,Grove,"In a follow-up to ""The Sympathizer,"" the man of two minds finds intellectual stimulation and customers for his narcotic merchandise in Paris."
9781524747800,,THE COLORS OF ALL THE CATTLE,Alexander McCall Smith,Pantheon,The 19th book in the No. 1 Ladies’ Detective Agency series.
9781250172501,,HEADS YOU WIN,Jeffrey Archer,St. Martin's,"When his father is assassinated by the K.G.B., Alexander Karpenko makes an irreversible choice based on a coin toss."
9781250122995,,OF BLOOD AND BONE,Nora Roberts,St. Martin's,"While the people of New Hope face threats, Fallon Swift goes on three quests to discover her powers."
9780316273947,,TARGET: ALEX CROSS,James Patterson,"Little, Brown",Alex Cross returns for the 26th book in the series bearing his name.
9781250066206,,KINGDOM OF THE BLIND,Louise Penny,Minotaur,"While on suspension, Chief Inspector Armand Gamache is made an executor of a stranger’s will and tries to keep a deadly narcotic off Montreal’s streets."
9780735215955,,TOM CLANCY: OATH OF OFFICE,Marc Cameron,Putnam,"President Jack Ryan must contain the fallout of a flu epidemic, an undermining senator and two hijacked Russian nuclear missiles."
9781538742945,,OUT OF NOWHERE,Sandra Brown,Grand Central,A shooting at a Texas county fair leads to an unexpected connection between a children’s book author and a corporate consultant.
9780062834874,,THE COLLECTOR,Daniel Silva,Harper,The 23rd book in the Gabriel Allon series. The art restorer teams up with a thief to find a missing painting and works to prevent a conflict between Russia and the West.
9781982182199,,DEAD FALL,Brad Thor,Atria/Emily Bestler,"The 22nd book in the Scot Harvath series. When American aid workers are killed amid other atrocities in Ukraine, America’s top spy is sent to set things right."
9780385545150,,CROOK MANIFESTO,Colson Whitehead,Doubleday,"In 1970s Harlem, a furniture store owner and his partner in crime find themselves up against shady and violent forces."
9780316499576,,OBSESSED,James Patterson and James O. Born,"Little, Brown","A killer, who targets women in New York City, becomes obsessed with Michael Bennett’s daughter."
9780593489932,,EVERYONE HERE IS LYING,Shari Lapena,Pamela Dorman,Things kept hidden bubble to the surface when the 9-year-old daughter of a man whose affair just ended badly goes missing.
9780316420327,,LOST,James Patterson and James O. Born,"Little, Brown",The new head of an F.B.I. task force takes on a crime syndicate run by a pair of Russian nationals.
9781101986936,,AGENCY,William Gibson,Berkley,"Ainsley Lowbeer can see alternate outcomes for Verity Jane and her digital assistant, who lived in the previous century."
9780525540670,,LONG BRIGHT RIVER,Liz Moore,Riverhead,Mickey risks her job with the Philadelphia police force by going after a murderer and searching for her missing sister.
9780399179532,,MORAL COMPASS,Danielle Steel,Delacorte,"Shortly after Saint Ambrose Prep goes co-ed, a student is attacked and the community falls apart."
9781538761601,,A MINUTE TO MIDNIGHT,David Baldacci,Grand Central,"When Atlee Pine returns to her hometown to investigate her sister’s kidnapping from 30 years ago, she winds up tracking a potential serial killer."
9781982154912,,THE RECOVERY AGENT,Janet Evanovich,Atria,"When her family’s home is threatened, Gabriela Rose goes with her ex-husband to seek lost treasure in the jungles of Peru."
9780593321096,,FRENCH BRAID,Anne Tyler,Knopf,The ups and downs of a Baltimore family from the 1950s to the pandemic present.
9781538748282,,THE MATCH,Harlan Coben,Grand Central,The second book in the Wilde series. Questions surface when Wilde connects with family members who have been out of his life.
9780593331262,,SHADOWS REEL,C.J. Box,Putnam,"The 22nd book in the Joe Pickett series. A fishing guide’s murder, stolen falcons and a Nazi official’s photo album heighten the danger."
9780063142268,,A SUNLIT WEAPON,Jacqueline Winspear,Harper,The 17th book in the Maisie Dobbs series. Dobbs works to uncover a plot that jeopardizes the safety of Eleanor Roosevelt.
9781982166793,,ONE ITALIAN SUMMER,Rebecca Serle,Atria,"During a summer trip in Italy, Katy’s late mother reappears as a 30-year-old woman."
9780062892409,,THE LIGHTNING ROD,Brad Meltzer,Morrow,The second book in the Escape Artist series. Zig stumbles upon a hidden group that threatens America's safety and security.
9780593331750,,A SAFE HOUSE,Stuart Woods,Putnam,The 61st book in the Stone Barrington series. Transporting secret cargo sends Stone on an adventure on both sides of the Atlantic.
9781635574074,,HOUSE OF SKY AND BREATH,Sarah J. Maas,Bloomsbury,The second book in the Crescent City series. Bryce Quinlan and Hunt Athalar must choose to fight or stay silent.
9780062997425,,THE CLUB,Ellery Lloyd,Harper,"Off the English coast, the body count rises at a celebrity members’ club."
9781538747209,,VERSES FOR THE DEAD,Douglas Preston and Lincoln Child,Grand Central,Agents Pendergast and Coldmoon track a killer who removes hearts and leaves handwritten letters.
9780735219250,,A DELICATE TOUCH,Stuart Woods,Putnam,The 48th book in the Stone Barrington series.
9781101985397,,THE BOY,Tami Hoag,Dutton,"Nick Fourcade and Annie Broussard, a husband-and-wife detective team, investigate a boy’s murder and the disappearance of his babysitter."
9781616208776,,AN AMERICAN MARRIAGE,Tayari Jones,Algonquin,A newlywed couple's relationship is tested when the husband is sentenced to 12 years in prison.
9780316526883,,CRISS CROSS,James Patterson,"Little, Brown",The 27th book in the Alex Cross series. Copycat crimes make the detective question whether an innocent man was executed.
9780385541213,,THE STARLESS SEA,Erin Morgenstern,Doubleday,Zachary Ezra Rawlins fights to save a labyrinthine underground repository of stories.
9780399180194,,TWISTED TWENTY-SIX,Janet Evanovich,Putnam,The 26th book in the Stephanie Plum series. A New Jersey gangster’s associates go after a bounty hunter’s widowed grandmother.
9780525522508,,LAND OF WOLVES,Craig Johnson,Viking,"The 15th book in the Longmire series. Back from Mexico, Sheriff Longmire must deal with a wolf and a killer on the loose."
9780316420297,,KILLER INSTINCT,James Patterson and Howard Roughan,"Little, Brown","The second book in the Instinct series. When an act of terror strikes New York, Dr. Reinhart and Detective Needham go after a sociopath."
9780735217263,,THE TITANIC SECRET,Clive Cussler and Jack Du Brul,Putnam,The 11th book in the Isaac Bell series. Dirk Pitt finds a document that brings a mystery from 1911 back to life.
9781250066213,,A BETTER MAN,Louise Penny,Minotaur,The 15th book in the Chief Inspector Gamache series. The search for a missing girl is imperiled by rising floodwaters across the province.
9781250207173,,VENDETTA IN DEATH,J.D. Robb,St. Martin's,The 49th book of the In Death series. Eve Dallas looks into the misdeeds of a wealthy businessman while a vigilante named Lady Justice uses disguises to avenge women who were wronged.
9781476749297,,THIS TENDER LAND,William Kent Krueger,Atria,Four orphans escape a Minnesota school and encounter a cross-section of different people struggling during the Great Depression.
9780316187169,,A LITTLE HATRED,Joe Abercrombie,Orbit,The Age of Madness series opens with a war erupting during a time of change.
9780593422724,,TOM CLANCY: ZERO HOUR,Don Bentley,Putnam,Jack Ryan Jr. appears to be the only person who can stop a second Korean war.
9781250278197,,NIGHTWORK,Nora Roberts,St. Martin's,"Harry Booth, a master thief, breaks things off with Miranda when a dangerous contact might harm her."
9780063119543,,COUNTERFEIT,Kirstin Chen,Morrow,"As Ava Wong’s perfect life unravels, her old college roommate from China wants to enlist her help with a counterfeit scheme."
9781538720943,,THE OMEGA FACTOR,Steve Berry,Grand Central,"The UNESCO investigator Nick Lee winds up on the trail of a panel from the Ghent Altarpiece, which was stolen in 1934."
9780593318935,,NIGHTCRAWLING,Leila Mottley,Knopf,"A young, struggling Black woman is identified as a key witness in a scandal within the Oakland Police Department."
9780316499378,,22 SECONDS,James Patterson and Maxine Paetro,"Little, Brown",The 22nd book in the Women’s Murder Club series. Lindsay Boxer returns as word gets around about a shipment of drugs and weapons.
9781501133572,,THE SUMMER PLACE,Jennifer Weiner,Atria,A wedding between Ruby Danhauser and her pandemic boyfriend at a family beach house in Cape Cod brings to light family secrets.
9781538719770,,DREAM TOWN,David Baldacci,Grand Central,"The third book in the Archer series. Archer, Dash and Callahan search for a missing screenwriter who had a dead body turn up in her home."
9780525541721,,TOM CLANCY: CODE OF HONOR,Marc Cameron,Putnam,President Jack Ryan learns of a plot against America when he tries to help an old friend who has been arrested in Indonesia.
9781668075081,,THE BUFFALO HUNTER HUNTER,Stephen Graham Jones,Saga,"A Lutheran pastor’s diary from 1912, which details a massacre in which 217 Blackfeet died in the snow, is found a century later."
9781668011874,,THE STORY SHE LEFT BEHIND,Patti Callahan Henry,Atria,"In 1952, the daughter of a renowned author who disappeared years ago goes in search of clues to better understand her mother’s life and work."
9780593851050,,BATTLE MOUNTAIN,C.J. Box,Putnam,The 25th book in the Joe Pickett series. Nate seeks vengeance while off the grid and Joe looks for the governor’s missing son-in-law.
9780593802724,,DREAM COUNT,Chimamanda Ngozi Adichie,Knopf,A Nigerian travel writer living in America and several women connected to her face turning points in their lives.
9781250827951,,WILD DARK SHORE,Charlotte McConaghy,Flatiron,"A woman washes ashore on a tiny island near Antarctica, where the only inhabitants are a man and his three children."
9781984881663,,THE PUSH,Ashley Audrain,Pamela Dorman,A devastating event forces a mother who questions her child’s behavior and her own sanity to confront the truth.
9781524745042,,BEFORE SHE DISAPPEARED,Lisa Gardner,Dutton,A recovering alcoholic puts herself in danger when she searches for a Haitian teenager in a Boston neighborhood.
9781538736821,,DEAD MOUNTAIN,Douglas Preston and Lincoln Child,Grand Central,The fourth book in the Nora Kelly series. Kelly and Swanson search for the ninth victim of a gruesome and bizarre incident that occurred in 2008.
9780063157781,,AFTER THAT NIGHT,Karin Slaughter,Morrow,The 11th book in the Will Trent series. Trent’s investigation of a young woman’s assault reveals a link to an attack 15 years ago.
9780316523097,,BIG SKY,Kate Atkinson,"Little, Brown",Detective Jackson Brodie uncovers a sinister network in a sleepy seaside town.
9780525541691,,TOM CLANCY: ENEMY CONTACT,Mike Maden,Putnam,Jack Ryan Jr. must stop an international criminal conspiracy and deal with tragic news.
9780525539612,,THE ORACLE,Clive Cussler and Robin Burcell,Putnam,"Treasure-hunting couple, Sam and Remi Fargo, embark on a new adventure to find a sacred ancient scroll and lift its curse."
9780385544252,,THE MOST FUN WE EVER HAD,Claire Lombardo,Doubleday,"The highs and lows of the four Sorenson sisters are illuminated when Jonah Bendt, who was given up in a closed adoption by one of them, arrives."
9781501165375,,THE LAST HOUSE GUEST,Megan Miranda,Simon & Schuster,Avery Greer must fight the clock to clear her name and uncover her friend’s real killer.
9780525521143,,THE GLASS HOTEL,Emily St,Knopf,"Years after an international Ponzi scheme falls apart, one of its victims investigates the disappearance of a woman from a container ship."
9781492682721,,THE MYSTERY OF MRS. CHRISTIE,Marie Benedict,Sourcebooks Landmark,What might have happened during the 11 days in which a rising mystery author went missing in 1926.
9780593188354,,HUSH-HUSH,Stuart Woods,Putnam,The 56th book in the Stone Barrington series. Old friends come to Stone’s aid as he takes on an expanding cabal of enemies.
9781963135411,,THE PRIMAL OF BLOOD AND BONE,Jennifer L. Armentrout,Blue Box,The sixth book in the Blood and Ash series. The Blood Crown has fallen and the Primal of Death must be stopped.
9780316597234,,ONE DARK WINDOW,Rachel Gillig,Orbit,Elspeth Spindle and the treasonous nephew to the king seek to gather 12 Providence Cards before solstice.
9780316597227,,TWO TWISTED CROWNS,Rachel Gillig,Orbit,The second book in the Shepherd King series. Elspeth and Ravyn go on a quest to save the kingdom.
9798217190041,,THIS INEVITABLE RUIN,Matt Dinniman,Ace,"The seventh book in the Dungeon Crawler Carl series. After becoming fully self-aware, the NPCs join the Faction Wars."
9781464261169,,ANATHEMA,Keri Lake,Bloom,"An assassin who dwells in Witch Knell is obsessed with Maevyth Bronwick, whose blood might help to break his curse."
9780593804728,,WHAT WE CAN KNOW,Ian McEwan,Knopf,"In 2119, a scholar living in a world of rising seas after a nuclear catastrophe seeks clues about a missing poem written in 2014."
9780307700155,,THE LONELINESS OF SONIA AND SUNNY,Kiran Desai,Hogarth,"A novelist and a journalist, whose grandparents once tried to arrange their union, go on a search for happiness together."
9780593595039,,BUCKEYE,Patrick Ryan,Random House,Consequences created by a secret forged between members of two families in a small Ohio town affect a new generation.
9781668059869,,"WE LOVE YOU, BUNNY",Mona Awad,Marysue Rucci,"A debut novelist is kidnapped by her former frenemies, who recount their dark adventures."
9781250272935,,LEGACY,Nora Roberts,St. Martin's,Threats put in rhymes and sent from shifting locations escalate as the daughter of a successful fitness celebrity’s own yoga business grows.
9780385546577,,WHILE JUSTICE SLEEPS,Stacey Abrams,Doubleday,"When Justice Wynn slips into a coma, his law clerk, Avery Keene, must unravel the clues of a controversial case."
9780593191224,,THE SABOTEURS,Clive Cussler and Jack Du Brul,Putnam,The 12th book in the Isaac Bell Adventure series. An assassination attempt reveals a deeper plot at the Panama Canal.
9780316499347,,21ST BIRTHDAY,James Patterson and Maxine Paetro,"Little, Brown",The 21st book in the Women’s Murder Club series. New evidence changes the investigation of a missing mother.
9780316530231,,THE DEVIL MAY DANCE,Jake Tapper,"Little, Brown","The second book in the Charlie and Margaret Marder Mystery series. Attorney General Robert Kennedy asks the Marders to look into a threat, which brings them into contact with the Rat Pack and the Church of Scientology."
9780593500224,,EMILY WILDE'S COMPENDIUM OF LOST TALES,Heather Fawcett,Del Rey,The third book in the Emily Wilde series. Wilde joins with a former academic rival to examine the inner workings of a faerie realm.
9781538770566,,THE MEDICI RETURN,Steve Berry,Grand Central,The 19th book in the Cotton Malone series. Malone goes to Italy to unravel a five-centuries-old mystery.
9781250355508,,THE NIGHT IS DEFYING,Chloe C. Peñaranda,Bramble,The second book in the Nytefall series. Shifting alliances and impending doom add pressure to Astraea and Nyte’s tenuous relationship.
9781250871749,,NEMESIS,Gregg Hurwitz,Minotaur,The 10th book in the Orphan X series. Things become combative between Evan Smoak and Tommy Stojack.
9781476707433,,TWO WEEKS,Karen Kingsbury,Howard,A pregnant 18-year-old has limited time to change her mind about giving her baby up for adoption.
9780062391957,,THE TALE TELLER,Anne Hillerman,Harper,"Investigations by Leaphorn, Chee and Manuelito overlap in the desert Southwest."
9780735218895,,METROPOLIS,Philip Kerr,Putnam,Bernie Gunther joins the Murder Commission in Berlin in 1928. The final Bernie Gunther novel completed before the author’s death.
9780385352680,,LOST AND WANTED,Nell Freudenberger,Knopf,An M.I.T. professor receives a phone call from her recently deceased screenwriter friend.
9780525619376,,STAR WARS: MASTER & APPRENTICE,Claudia Gray,Del Rey,The bond between Qui-Gon Jinn and Obi-Wan Kenobi is tested when they go on a mission to the royal court of Pijal.
9781524748210,,THE DEPARTMENT OF SENSITIVE CRIMES,Alexander McCall Smith,Pantheon,A quirky team of Swedish detectives take on bizarre and tricky cases.
9780593157534,,UPGRADE,Blake Crouch,Ballantine,Logan Ramsay’s genome has been hacked and he is the only person who can prevent this from happening to the public at large.
9781982182151,,RISING TIGER,Brad Thor,Atria/Emily Bestler,The 21st book in the Scot Harvath series. The American spy faces dangers on a mission in an unfamiliar culture.
9781984818843,,THE BEST IS YET TO COME,Debbie Macomber,Ballantine,"After the death of her twin brother, Hope starts a relationship with a former Marine."
9780062473271,,MICHAEL CRICHTON: THE ANDROMEDA EVOLUTION,Daniel H. Wilson,Harper,A team of experts is assembled to stop an evolving and potentially apocalyptic microbe.
9780062913463,,NOTHING TO SEE HERE,Kevin Wilson,Ecco,"Madison enlists her former boarding school roommate to look after her twin stepchildren, who burst into flames when agitated."
9781250140302,,THE WARSAW PROTOCOL,Steve Berry,Minotaur,The 15th book in the Cotton Malone series. The balance of power in Europe is imperiled.
9781496718891,,COCONUT LAYER CAKE MURDER,Joanne Fluke,Kensington,The bakery owner Hannah Swensen’s sister’s boyfriend is accused of murder.
